{"schema":"https://debz.dev/schema/native-execution-intent-v2","version":2,"attempt_id":"aaaaaaaaaaaaaaaaaaaaaaaaaaaaaaaaaaaaaaaaaaaaaaaaaaaaaaaaaaaaaaaa","install_root":"/srv/root","root_identity_sha256":"1b292ed83668a7231965384ce66f907a5ebd141db7f6f127fe3cad8ef6589b90","root_inode":42,"operation":"install","architecture":"amd64","policy":"keep_existing","triggers":false,"defer_triggers":false,"staging_directory_initially_present":false,"packages":[{"name":"seed","architecture":"all"}],"ordered_actions":[{"sequence":0,"kind":"unpack","package":"seed","version":"1","architecture":"all"},{"sequence":1,"kind":"configure_pending","package":"seed","version":"1","architecture":"all"}],"request_sha256":"0000000000000000000000000000000000000000000000000000000000000000","policy_sha256":"1111111111111111111111111111111111111111111111111111111111111111","authorization_sha256":"d10399f4ed78c139668ad19080e2e94dd2a70c4f646f4c1a9b5ac5449be507a2","program_sha256":"85e18358b9e7329377b3f67661d29a5cb805302b512a762956f6040f3e72d7e8","exact_lock_sha256":"9d3535edadd65511998ac3e2b55707cd65860d4d72445879214eb387645c21eb","artifact_evidence_sha256":"caaae589ca82b557ea944cb981604e10791c02fdb8b8377e6b8853e3a0f9126f","database_generation_sha256":"7171717171717171717171717171717171717171717171717171717171717171","initial_trigger_state_sha256":"0000000000000000000000000000000000000000000000000000000000000000","authorization_schema":"https://debz.dev/schema/native-transaction-authorization-v2","authorization_version":2,"program_schema":"https://debz.dev/schema/native-transaction-program-v2","program_version":2,"exact_lock_schema":"https://debz.dev/schema/exact-closure-lock-v3","exact_lock_version":3,"authorization_path":"native-transaction-authorization-v2.json","program_path":"native-transaction-program-v2.json","blobs":[{"kind":"request","key":"execution-request","logical_path":"request/native-execution-request-v4.json","storage_path":"var/lib/debz/native-recovery-v1/request/native-execution-request-v4.json","size":2166,"sha256":"47cc5cfcd043b14f17fc9c0eec1038108dabd59ee9def83b6660567fc83d6677","mode":384,"entry_kind":"regular"}],"digest_sha256":"0c4ce9685e47af891f4f9da19f467b58521a2a92ba030c9ec5937ee3324731f2"}
